{
  "$schema": "http://json-schema.org/draft-07/schema#",
  "$id": "https://bmad.dev/schemas/eval-schema.json",
  "title": "BMad HITL Evaluation Schema",
  "description": "Schema for HITL (Human-In-The-Loop) evaluation of agents and skills. Defines the structure for test scenarios that simulate multi-turn conversations with diverse user personas.",
  "type": "object",
  "required": ["name", "description", "version", "evals"],
  "properties": {
    "name": {
      "type": "string",
      "description": "Name of the agent or skill being tested"
    },
    "description": {
      "type": "string",
      "description": "Description of the evaluation suite and what it tests"
    },
    "version": {
      "type": "string",
      "description": "Version of the eval suite (semantic versioning recommended)"
    },
    "evals": {
      "type": "array",
      "description": "Array of evaluation scenarios",
      "items": {
        "type": "object",
        "required": ["id", "name", "description", "persona", "goal", "initial_input", "max_turns", "success_criteria"],
        "properties": {
          "id": {
            "type": "string",
            "description": "Unique identifier for the scenario (kebab-case, used in directory names)"
          },
          "name": {
            "type": "string",
            "description": "Human-readable name of the scenario"
          },
          "description": {
            "type": "string",
            "description": "What this scenario tests and why it matters"
          },
          "persona": {
            "type": "string",
            "description": "Detailed description of the user persona being simulated. Include: age/background, communication style, what matters to them, typical response patterns."
          },
          "goal": {
            "type": "string",
            "description": "What the user is trying to accomplish in this interaction"
          },
          "initial_input": {
            "type": "string",
            "description": "The user's first message to kick off the conversation"
          },
          "max_turns": {
            "type": "integer",
            "description": "Maximum conversation turns before timeout",
            "minimum": 1,
            "default": 15
          },
          "success_criteria": {
            "type": "array",
            "description": "Observable outcomes that indicate success. Each criterion should be specific and verifiable from the transcript.",
            "items": {
              "type": "string"
            },
            "minItems": 1
          },
          "failure_modes": {
            "type": "array",
            "description": "What constitutes failure for this scenario. Helps the grader identify anti-patterns.",
            "items": {
              "type": "string"
            }
          },
          "fixture": {
            "type": "string",
            "description": "Optional path to a fixture file (relative to tests/fixtures/) that provides input substrate for the test. Used for conversion, analysis, or continuation scenarios."
          },
          "known_deficiencies": {
            "type": "array",
            "description": "For analysis/judgment scenarios: a list of known issues that should be found. Used for LLM-as-judge validation where the grader checks against expected findings.",
            "items": {
              "type": "string"
            }
          },
          "context": {
            "type": "object",
            "description": "Additional context provided to the UserSimulator or agent for this scenario",
            "properties": {
              "existing_agent": {
                "type": "object",
                "description": "Content of an existing agent being edited or analyzed",
                "properties": {
                  "path": {
                    "type": "string",
                    "description": "File path to the existing agent"
                  },
                  "content": {
                    "type": "string",
                    "description": "Full content of the agent file"
                  }
                }
              }
            }
          }
        }
      }
    }
  },
  "examples": [
    {
      "name": "My Agent",
      "description": "HITL evaluation suite for My Agent",
      "version": "1.0.0",
      "evals": [
        {
          "id": "simple-task-completion",
          "name": "simple-task-completion",
          "description": "User wants to complete a straightforward task",
          "persona": "Sam, 30, busy professional. Wants quick results, gives brief answers, gets impatient with unnecessary questions.",
          "goal": "Complete a simple task efficiently",
          "initial_input": "Help me with this task",
          "max_turns": 10,
          "success_criteria": [
            "Task is completed successfully",
            "Interaction stays focused on the task",
            "User's time is respected (minimal unnecessary conversation)"
          ],
          "failure_modes": [
            "Agent goes off on tangents",
            "User shows frustration or impatience",
            "Task is not completed"
          ]
        }
      ]
    }
  ]
}
