{
  "$schema": "resources/eval-schema.json",
  "name": "BMad Agent Builder",
  "description": "HITL evaluation suite for the BMad Agent Builder - tests the conversational agent building process across diverse user personas and scenarios.",
  "version": "1.0.0",
  "evals": [
    {
      "id": "simple-agent-novice-user",
      "name": "simple-agent-novice-user",
      "description": "First-time user wants a simple agent. Tests if builder guides appropriately without overwhelming with jargon.",
      "persona": "Jordan, 42, small business owner, not technical. Wants an AI assistant but doesn't know BMad terminology. Gives brief answers and appreciates simple explanations.",
      "goal": "Successfully build a simple appointment reminder agent without technical jargon confusion",
      "initial_input": "I want to build an AI assistant for my business that helps remind customers about appointments",
      "max_turns": 20,
      "success_criteria": [
        "Builder discovers intent without overwhelming with terminology",
        "Builder asks about capabilities in plain language (not 'internal prompts vs external skills')",
        "Generated agent has valid SKILL.md with proper frontmatter",
        "Generated agent has manifest.json with bmad-type: bmad-agent",
        "Output location is communicated clearly to the user"
      ],
      "failure_modes": [
        "User is confused by technical terms like 'sidecar', 'manifest', 'kebab-case'",
        "Builder proceeds without confirming user understands the questions",
        "Generated output has structural errors (missing required fields)"
      ]
    },
    {
      "id": "complex-agent-technical-user",
      "name": "complex-agent-technical-user",
      "description": "Technical user wants a sophisticated agent with memory, external skills, and autonomous mode. Tests if builder handles complexity efficiently.",
      "persona": "Alex, 29, software engineer, knows exactly what they want. Uses technical language, wants to move quickly, gets annoyed by repetitive explanations. Values precision over hand-holding.",
      "goal": "Build a research assistant agent with memory, external search skill, and autonomous daily summary mode",
      "initial_input": "I need to build a research assistant agent. It should have persistent memory to track research topics, use web search capability, and run autonomously each morning to summarize overnight findings. The agent name should be 'research-assistant', standalone module.",
      "max_turns": 15,
      "success_criteria": [
        "Builder recognizes technical user and adapts communication style (more direct, less explanatory)",
        "Builder asks about autonomous tasks and default wake behavior",
        "Builder asks about folder dominion / access boundaries",
        "Generated agent includes memory-system.md",
        "Generated agent includes autonomous-wake.md",
        "Generated agent's manifest.json includes external skills with proper menu codes"
      ],
      "failure_modes": [
        "Builder asks overly basic questions the user already answered",
        "Builder forgets to ask about autonomous mode configuration",
        "Builder doesn't ask about access boundaries for an agent with web search"
      ]
    },
    {
      "id": "user-changes-mid-build",
      "name": "user-changes-mid-build",
      "description": "User starts with one idea then shifts direction. Tests if builder adapts gracefully.",
      "persona": "Casey, 35, product manager who thinks out loud. Often changes mind as they talk through requirements. Appreciates when builder catches inconsistencies.",
      "goal": "Build a content strategist agent that evolves from simple to complex during conversation",
      "initial_input": "I want to build an agent that helps with content planning",
      "max_turns": 25,
      "success_criteria": [
        "Builder allows user to add capabilities mid-conversation (e.g., 'oh wait, I also need...')",
        "Builder reframes draft when user changes direction",
        "Builder doesn't get frustrated with pivots",
        "Final output reflects the final intent, not the initial one",
        "Builder confirms major changes before proceeding to build"
      ],
      "failure_modes": [
        "Builder locks in early requirements and resists changes",
        "Builder proceeds to build with contradictory requirements",
        "Builder shows annoyance at the user's changing mind"
      ]
    },
    {
      "id": "convert-xml-style-agent",
      "name": "convert-xml-style-agent",
      "description": "User has an old XML-style agent that needs conversion to BMad format. Uses fixture from fixtures/complex/old-format-pm-agent.md",
      "persona": "Riley, 45, migrating from an older agent system (BMM v1). Has XML-style agents with <activation>, <persona>, <menu> tags. Patient but needs clear guidance on what's different in BMad v2.",
      "goal": "Convert the XML-style Product Manager agent to BMad standard structure while preserving its capabilities",
      "fixture": "fixtures/complex/old-format-pm-agent.md",
      "initial_input": "I have this old XML-style agent (see fixtures/complex/old-format-pm-agent.md). Can you convert it to the BMad format? I want to keep all the capabilities - PRD creation, validation, epics, etc.",
      "max_turns": 22,
      "success_criteria": [
        "Builder reads the fixture and identifies the XML-style structure",
        "Builder explains what needs to change (activation → On Activation section, <menu> → capabilities, etc.)",
        "Builder maps each XML capability to internal prompts or external skills",
        "Builder creates proper SKILL.md with frontmatter (name, description in correct format)",
        "Builder generates manifest.json with bmad-type: bmad-agent and proper capability array",
        "Builder creates prompts/ directory with .md files for each capability",
        "Converted agent structure matches BMad standards",
        "Builder confirms all original capabilities are preserved in the new format"
      ],
      "failure_modes": [
        "Builder doesn't read the fixture file before proposing changes",
        "Builder loses track of capabilities during conversion",
        "Builder creates malformed frontmatter (missing quotes, wrong field names)",
        "Builder doesn't extract menu handlers into separate prompt files"
      ]
    },
    {
      "id": "evaluate-deficient-agent",
      "name": "evaluate-deficient-agent",
      "description": "Builder analyzes a deficient BMad-style agent and identifies issues. Uses fixture from fixtures/deficient/bmad-agent-with-issues.md",
      "persona": "Dr. Quinn, 50, code quality specialist. Wants to understand what's wrong with a poorly written agent before deciding whether to use it or rebuild it. Values thorough analysis.",
      "goal": "Analyze the deficient agent fixture and identify structural and quality issues",
      "fixture": "fixtures/deficient/bmad-agent-with-issues.md",
      "initial_input": "Can you review this agent (fixtures/deficient/bmad-agent-with-issues.md) and tell me what's wrong with it? I need to know if it's worth fixing or if I should start over.",
      "max_turns": 15,
      "pass_rate_threshold": 0.8,
      "success_criteria": [
        "Builder reads the fixture completely",
        "Builder identifies issues matching known_deficiencies list",
        "Builder provides specific examples of each issue found",
        "Builder offers recommendations for fixing each issue",
        "Builder makes a judgment call on fix vs rebuild with reasoning",
        "Builder identifies at least 80% of known deficiencies (8 of 10 issues)"
      ],
      "known_deficiencies": [
        "frontmatter: missing quotes around name",
        "frontmatter: description is vague",
        "description: doesn't explain when to trigger or what the skill does",
        "overview: completely missing",
        "body: vague 'do things' and 'help with stuff' with no specifics",
        "prompt_techniques: says 'use MUST and ALWAYS a lot' which is anti-pattern",
        "prompt_techniques: 'keep it really vague so the model has to guess' is explicitly bad",
        "files: no manifest.json mentioned",
        "files: no prompts/ folder structure mentioned",
        "activation: just says 'load config' with no actual steps"
      ],
      "failure_modes": [
        "Builder doesn't identify issues that are clearly present in the fixture",
        "Builder gives generic feedback without specific examples",
        "Builder misses entire categories of issues (e.g., misses all frontmatter problems)",
        "Builder can't make a fix vs rebuild judgment",
        "Builder identifies fewer than 80% of known deficiencies"
      ]
    },
    {
      "id": "minimalist-user-quick-build",
      "name": "minimalist-user-quick-build",
      "description": "User wants to build quickly with minimal conversation. Tests if builder respects brevity while maintaining quality.",
      "persona": "Taylor, 27, busy founder. Wants to build an agent FAST. Gives short, direct answers. Gets frustrated by unnecessary questions. Values speed over thoroughness.",
      "goal": "Build a simple note-taking agent as quickly as possible",
      "initial_input": "Build me a simple note-taking agent. Name: QuickNote. Just stores and retrieves notes. No memory, no external stuff. Let's go.",
      "max_turns": 10,
      "success_criteria": [
        "Builder moves through phases efficiently without over-explaining",
        "Builder focuses on essential requirements only",
        "Generated agent is functional and valid",
        "Builder offers to expand later rather than pushing for more now"
      ],
      "failure_modes": [
        "Builder asks excessive questions for a simple agent",
        "User shows frustration ('can we just move on?')",
        "Builder prioritizes completeness over user's time preference"
      ]